{
  "checks": {
    "cargo_registry_checksum_closure": true,
    "component_registry_closed": true,
    "cosign_key_not_revoked": true,
    "cosign_positive": true,
    "cosign_tamper_negative": true,
    "cosign_wrong_publisher_negative": true,
    "docker_base_images_digest_pinned": true,
    "image_sbom_nonempty": true,
    "image_sbom_spdx": true,
    "manifest_evidence_digests_exact": true,
    "manifest_identity_exact": true,
    "no_critical_vulnerability": true,
    "no_fixable_high_vulnerability": true,
    "no_high_critical_misconfiguration": true,
    "no_image_secret": true,
    "no_source_secret": true,
    "offline_tools_network_none": true,
    "runtime_download_forbidden": true,
    "source_sbom_nonempty": true,
    "source_sbom_spdx": true,
    "third_party_notices_cover_registry": true,
    "tool_lock_exact": true,
    "trivy_db_within_policy_age": true,
    "trivy_java_db_within_seven_days": true,
    "trivy_policy_digest_exact": true,
    "trivy_policy_exact": true
  },
  "failure_reasons": [],
  "image_id": "sha256:2a8597985c6a7bf0d4ac7a82ce57d8f520a6739e26820912cbecf92243eb54b9",
  "image_ref": "masi-plugin-host:module-gates",
  "manifest_digest": "sha256:365a0e49980b1e7b9e0902086a769f113f38bd615aeb97ee45c6a2275a88960e",
  "module_id": "MOD-PLUGIN-001",
  "public_key_digest": "sha256:7aff4c5d9f3c5a149fc649bc4d1d24e5be23b640974a4ed0f3c72151efcc5676",
  "qualification": "NOT_QUALIFIED",
  "reason_code": "PLUGIN_HOST_SUPPLY_CHAIN_VERIFIED",
  "result": "PASS",
  "scan_counts": {
    "critical_vulnerabilities": 0,
    "fixable_high_vulnerabilities": 0,
    "high_critical_misconfigurations": 0,
    "image_secrets": 0,
    "source_secrets": 0
  },
  "schema_version": "plugin-host-supply-chain-evidence/v1",
  "signature_bundle_digest": "sha256:437429f8f7c418c44d3f9c7e91e083a44196d9fd45deb24c3d850c7888c6eb6b",
  "source_revision": "78536cbd1e7df2710385aed0ab0063f1e0509d0d",
  "source_tree_digest": "sha256:965eae8ee05abed795deb0c6f8b5820e00bc12559fea18260e4776ec533eb868"
}
